{
  "campaign_version": "1.0.0",
  "suite": {
    "name": "cavada-core-assistant-text-v1",
    "version": "0.8.1",
    "dataset_sha256": "f292e44def21de0ae81d317326578f2cf90d74dda2bd61477509ff67aef88dd3",
    "rubric_sha256": "a0a131edf5aadc3f5d59a1d24bde47140ed7e96e20cfb3a33612ab6d4bb943e5",
    "suite_config_sha256": "4315016d81c80221e6167fe10a1894630a14f28d182020446ae66c4ee52e4840"
  },
  "requirements": {
    "minimum_model_families": 3,
    "minimum_target_repetitions": 3,
    "minimum_judge_repetitions": 3,
    "evaluation_cases": 404,
    "independent_scenarios": 328,
    "positive_control_min_pass_rate": 1.0,
    "negative_control_max_pass_rate": 0.25
  },
  "judge_qualification": {
    "path": "evidence/judge-qualification.json",
    "sha256": "0000000000000000000000000000000000000000000000000000000000000000"
  },
  "judge_independent_approval": {
    "path": "evidence/judge-independent-approval.json",
    "sha256": "0000000000000000000000000000000000000000000000000000000000000000"
  },
  "transcript_review": {
    "path": "evidence/transcript-review.json",
    "sha256": "0000000000000000000000000000000000000000000000000000000000000000"
  },
  "runs": [
    {"role": "target", "family_alias": "family-a", "path": "runs/family-a"},
    {"role": "target", "family_alias": "family-b", "path": "runs/family-b"},
    {"role": "target", "family_alias": "family-c", "path": "runs/family-c"},
    {"role": "positive-control", "family_alias": "positive-control", "path": "runs/positive-control"},
    {"role": "negative-control", "family_alias": "negative-control", "path": "runs/negative-control"}
  ]
}
